(python) ➜  mdns_experiment git:(main) sudo tcpdump -i any port 5353
[sudo] password for sky: 
tcpdump: data link type LINUX_SLL2
tcpdump: verbose output suppressed, use -v[v]... for full protocol decode
listening on any, link-type LINUX_SLL2 (Linux cooked v2), snapshot length 262144 bytes
09:52:43.336336 eth1  Out IP 169.254.83.107.mdns > mdns.mcast.net.mdns: 0*- [0q] 5/0/0 PTR MyPythonService._http._tcp.local., (Cache flush) SRV LUM-LT-JPLKB54.local.:8000 0 0, (Cache flush) TXT "path=/" "model=ABC001122" "vendor=confy", (Cache flush) NSEC, (Cache flush) A 127.0.1.1 (177)
09:52:43.336359 eth5  Out IP 192.168.100.207.mdns > mdns.mcast.net.mdns: 0*- [0q] 5/0/0 PTR MyPythonService._http._tcp.local., (Cache flush) SRV LUM-LT-JPLKB54.local.:8000 0 0, (Cache flush) TXT "path=/" "model=ABC001122" "vendor=confy", (Cache flush) NSEC, (Cache flush) A 127.0.1.1 (177)
09:52:43.336374 eth2  Out IP host.docker.internal.mdns > mdns.mcast.net.mdns: 0*- [0q] 5/0/0 PTR MyPythonService._http._tcp.local., (Cache flush) SRV LUM-LT-JPLKB54.local.:8000 0 0, (Cache flush) TXT "path=/" "model=ABC001122" "vendor=confy", (Cache flush) NSEC, (Cache flush) A 127.0.1.1 (177)
09:52:43.336386 lo    In  IP localhost.mdns > mdns.mcast.net.mdns: 0*- [0q] 5/0/0 PTR MyPythonService._http._tcp.local., (Cache flush) SRV LUM-LT-JPLKB54.local.:8000 0 0, (Cache flush) TXT "path=/" "model=ABC001122" "vendor=confy", (Cache flush) NSEC, (Cache flush) A 127.0.1.1 (177)
09:52:44.653877 eth2  Out IP host.docker.internal.mdns > mdns.mcast.net.mdns: 0 [b2&3=0x400] [1n] PTR (QU)? _http._tcp.local. (64)
09:52:44.653890 eth1  Out IP 169.254.83.107.mdns > mdns.mcast.net.mdns: 0 [b2&3=0x400] [1n] PTR (QU)? _http._tcp.local. (64)
09:52:44.653899 eth5  Out IP 192.168.100.207.mdns > mdns.mcast.net.mdns: 0 [b2&3=0x400] [1n] PTR (QU)? _http._tcp.local. (64)
09:52:44.653914 lo    In  IP 10.255.255.254.mdns > mdns.mcast.net.mdns: 0 [b2&3=0x400] [1n] PTR (QU)? _http._tcp.local. (64)
09:52:44.830917 eth2  Out IP host.docker.internal.mdns > mdns.mcast.net.mdns: 0 [b2&3=0x400] [1n] PTR (QU)? _http._tcp.local. (64)
09:52:44.830939 eth1  Out IP 169.254.83.107.mdns > mdns.mcast.net.mdns: 0 [b2&3=0x400] [1n] PTR (QU)? _http._tcp.local. (64)
09:52:44.830953 eth5  Out IP 192.168.100.207.mdns > mdns.mcast.net.mdns: 0 [b2&3=0x400] [1n] PTR (QU)? _http._tcp.local. (64)
09:52:44.830966 lo    In  IP 10.255.255.254.mdns > mdns.mcast.net.mdns: 0 [b2&3=0x400] [1n] PTR (QU)? _http._tcp.local. (64)
09:52:45.006943 eth2  Out IP host.docker.internal.mdns > mdns.mcast.net.mdns: 0 [b2&3=0x400] [1n] PTR (QU)? _http._tcp.local. (64)
09:52:45.006963 eth1  Out IP 169.254.83.107.mdns > mdns.mcast.net.mdns: 0 [b2&3=0x400] [1n] PTR (QU)? _http._tcp.local. (64)
09:52:45.006975 eth5  Out IP 192.168.100.207.mdns > mdns.mcast.net.mdns: 0 [b2&3=0x400] [1n] PTR (QU)? _http._tcp.local. (64)
09:52:45.006987 lo    In  IP 10.255.255.254.mdns > mdns.mcast.net.mdns: 0 [b2&3=0x400] [1n] PTR (QU)? _http._tcp.local. (64)
09:52:45.007193 eth2  Out IP host.docker.internal.mdns > mdns.mcast.net.mdns: 0*- [0q] 5/0/0 PTR MyPythonService._http._tcp.local., (Cache flush) SRV LUM-LT-JPLKB54.local.:8000 0 0, (Cache flush) TXT "path=/" "model=ABC001122" "vendor=confy", (Cache flush) NSEC, (Cache flush) A 127.0.1.1 (177)
09:52:45.007201 eth1  Out IP 169.254.83.107.mdns > mdns.mcast.net.mdns: 0*- [0q] 5/0/0 PTR MyPythonService._http._tcp.local., (Cache flush) SRV LUM-LT-JPLKB54.local.:8000 0 0, (Cache flush) TXT "path=/" "model=ABC001122" "vendor=confy", (Cache flush) NSEC, (Cache flush) A 127.0.1.1 (177)
09:52:45.007206 eth5  Out IP 192.168.100.207.mdns > mdns.mcast.net.mdns: 0*- [0q] 5/0/0 PTR MyPythonService._http._tcp.local., (Cache flush) SRV LUM-LT-JPLKB54.local.:8000 0 0, (Cache flush) TXT "path=/" "model=ABC001122" "vendor=confy", (Cache flush) NSEC, (Cache flush) A 127.0.1.1 (177)
09:52:45.007210 lo    In  IP 10.255.255.254.mdns > mdns.mcast.net.mdns: 0*- [0q] 5/0/0 PTR MyPythonService._http._tcp.local., (Cache flush) SRV LUM-LT-JPLKB54.local.:8000 0 0, (Cache flush) TXT "path=/" "model=ABC001122" "vendor=confy", (Cache flush) NSEC, (Cache flush) A 127.0.1.1 (177)
09:52:45.007586 lo    In  IP host.docker.internal.mdns > host.docker.internal.mdns: 0*- [0q] 1/0/4 PTR MyPythonService._http._tcp.local. (177)
09:52:45.007613 eth2  Out IP host.docker.internal.mdns > mdns.mcast.net.mdns: 0*- [0q] 1/0/4 PTR MyPythonService._http._tcp.local. (177)
09:52:45.007622 eth1  Out IP 169.254.83.107.mdns > mdns.mcast.net.mdns: 0*- [0q] 1/0/4 PTR MyPythonService._http._tcp.local. (177)
09:52:45.007629 eth5  Out IP 192.168.100.207.mdns > mdns.mcast.net.mdns: 0*- [0q] 1/0/4 PTR MyPythonService._http._tcp.local. (177)
09:52:45.007634 lo    In  IP 10.255.255.254.mdns > mdns.mcast.net.mdns: 0*- [0q] 1/0/4 PTR MyPythonService._http._tcp.local. (177)
09:52:45.007722 lo    In  IP 169.254.83.107.mdns > 169.254.83.107.mdns: 0*- [0q] 1/0/4 PTR MyPythonService._http._tcp.local. (177)
09:52:45.007739 eth2  Out IP host.docker.internal.mdns > mdns.mcast.net.mdns: 0*- [0q] 1/0/4 PTR MyPythonService._http._tcp.local. (177)
09:52:45.007745 eth1  Out IP 169.254.83.107.mdns > mdns.mcast.net.mdns: 0*- [0q] 1/0/4 PTR MyPythonService._http._tcp.local. (177)
09:52:45.007834 eth5  Out IP 192.168.100.207.mdns > mdns.mcast.net.mdns: 0*- [0q] 1/0/4 PTR MyPythonService._http._tcp.local. (177)
09:52:45.007843 lo    In  IP 10.255.255.254.mdns > mdns.mcast.net.mdns: 0*- [0q] 1/0/4 PTR MyPythonService._http._tcp.local. (177)
09:52:45.008042 lo    In  IP 192.168.100.207.mdns > 192.168.100.207.mdns: 0*- [0q] 1/0/4 PTR MyPythonService._http._tcp.local. (177)
09:52:45.008169 lo    In  IP 10.255.255.254.mdns > 10.255.255.254.mdns: 0*- [0q] 1/0/4 PTR MyPythonService._http._tcp.local. (177)
09:52:45.233489 eth2  Out IP host.docker.internal.mdns > mdns.mcast.net.mdns: 0*- [0q] 5/0/0 PTR MyPythonService._http._tcp.local., (Cache flush) SRV LUM-LT-JPLKB54.local.:8000 0 0, (Cache flush) TXT "path=/" "model=ABC001122" "vendor=confy", (Cache flush) NSEC, (Cache flush) A 127.0.1.1 (177)
09:52:45.233504 eth1  Out IP 169.254.83.107.mdns > mdns.mcast.net.mdns: 0*- [0q] 5/0/0 PTR MyPythonService._http._tcp.local., (Cache flush) SRV LUM-LT-JPLKB54.local.:8000 0 0, (Cache flush) TXT "path=/" "model=ABC001122" "vendor=confy", (Cache flush) NSEC, (Cache flush) A 127.0.1.1 (177)
09:52:45.233520 eth5  Out IP 192.168.100.207.mdns > mdns.mcast.net.mdns: 0*- [0q] 5/0/0 PTR MyPythonService._http._tcp.local., (Cache flush) SRV LUM-LT-JPLKB54.local.:8000 0 0, (Cache flush) TXT "path=/" "model=ABC001122" "vendor=confy", (Cache flush) NSEC, (Cache flush) A 127.0.1.1 (177)
09:52:45.233530 lo    In  IP 10.255.255.254.mdns > mdns.mcast.net.mdns: 0*- [0q] 5/0/0 PTR MyPythonService._http._tcp.local., (Cache flush) SRV LUM-LT-JPLKB54.local.:8000 0 0, (Cache flush) TXT "path=/" "model=ABC001122" "vendor=confy", (Cache flush) NSEC, (Cache flush) A 127.0.1.1 (177)
09:52:45.460410 eth2  Out IP host.docker.internal.mdns > mdns.mcast.net.mdns: 0*- [0q] 5/0/0 PTR MyPythonService._http._tcp.local., (Cache flush) SRV LUM-LT-JPLKB54.local.:8000 0 0, (Cache flush) TXT "path=/" "model=ABC001122" "vendor=confy", (Cache flush) NSEC, (Cache flush) A 127.0.1.1 (177)
09:52:45.460428 eth1  Out IP 169.254.83.107.mdns > mdns.mcast.net.mdns: 0*- [0q] 5/0/0 PTR MyPythonService._http._tcp.local., (Cache flush) SRV LUM-LT-JPLKB54.local.:8000 0 0, (Cache flush) TXT "path=/" "model=ABC001122" "vendor=confy", (Cache flush) NSEC, (Cache flush) A 127.0.1.1 (177)
09:52:45.460438 eth5  Out IP 192.168.100.207.mdns > mdns.mcast.net.mdns: 0*- [0q] 5/0/0 PTR MyPythonService._http._tcp.local., (Cache flush) SRV LUM-LT-JPLKB54.local.:8000 0 0, (Cache flush) TXT "path=/" "model=ABC001122" "vendor=confy", (Cache flush) NSEC, (Cache flush) A 127.0.1.1 (177)
09:52:45.460450 lo    In  IP 10.255.255.254.mdns > mdns.mcast.net.mdns: 0*- [0q] 5/0/0 PTR MyPythonService._http._tcp.local., (Cache flush) SRV LUM-LT-JPLKB54.local.:8000 0 0, (Cache flush) TXT "path=/" "model=ABC001122" "vendor=confy", (Cache flush) NSEC, (Cache flush) A 127.0.1.1 (177)
09:52:48.015019 eth2  M   IP 192.168.1.143.mdns > mdns.mcast.net.mdns: 0 PTR (QM)? _spotify-connect._tcp.local. (45)
09:52:48.015489 eth2  M   IP 192.168.1.143.mdns > mdns.mcast.net.mdns: 0 PTR (QM)? _spotify-connect._tcp.local. (45)
09:52:48.016323 eth2  M   IP6 fe80::34f3:54ff:fef4:c27e.mdns > ff02::fb.mdns: 0 PTR (QM)? _spotify-connect._tcp.local. (45)
09:52:48.016921 eth2  M   IP6 fe80::34f3:54ff:fef4:c27e.mdns > ff02::fb.mdns: 0 PTR (QM)? _spotify-connect._tcp.local. (45)
09:53:04.141941 eth2  M   IP 192.168.1.174.mdns > mdns.mcast.net.mdns: 0 PTR (QM)? _googlecast._tcp.local. (40)
09:53:04.141942 eth2  M   IP 192.168.1.174.mdns > mdns.mcast.net.mdns: 0 PTR (QM)? _googlecast._tcp.local. (40)
09:53:04.143154 eth2  M   IP 192.168.1.174.mdns > mdns.mcast.net.mdns: 0 PTR (QM)? _googlecast._tcp.local. (40)
09:53:04.143235 eth2  M   IP 192.168.1.174.mdns > mdns.mcast.net.mdns: 0 PTR (QM)? _googlecast._tcp.local. (40)
09:53:04.144449 eth2  M   IP6 fe80::95e7:94e5:4975:1a10.mdns > ff02::fb.mdns: 0 PTR (QM)? _googlecast._tcp.local. (40)
09:53:04.144977 eth2  M   IP6 fe80::95e7:94e5:4975:1a10.mdns > ff02::fb.mdns: 0 PTR (QM)? _googlecast._tcp.local. (40)
09:53:04.247357 eth2  M   IP6 fe80::95e7:94e5:4975:1a10.mdns > ff02::fb.mdns: 0 PTR (QM)? _googlecast._tcp.local. (40)
09:53:04.247358 eth2  M   IP6 fe80::95e7:94e5:4975:1a10.mdns > ff02::fb.mdns: 0 PTR (QM)? _googlecast._tcp.local. (40)
09:53:04.247358 eth2  M   IP6 fe80::95e7:94e5:4975:1a10.mdns > ff02::fb.mdns: 0 PTR (QM)? _googlecast._tcp.local. (40)
09:53:04.248303 eth2  M   IP6 fe80::95e7:94e5:4975:1a10.mdns > ff02::fb.mdns: 0 PTR (QM)? _googlecast._tcp.local. (40)
09:53:04.248304 eth2  M   IP6 fe80::95e7:94e5:4975:1a10.mdns > ff02::fb.mdns: 0 PTR (QM)? _googlecast._tcp.local. (40)
09:53:04.248304 eth2  M   IP6 fe80::95e7:94e5:4975:1a10.mdns > ff02::fb.mdns: 0 PTR (QM)? _googlecast._tcp.local. (40)
09:53:08.234108 eth2  M   IP 192.168.1.190.mdns > mdns.mcast.net.mdns: 0 [3q] [4n] ANY (QM)? 190.1.168.192.in-addr.arpa. ANY (QM)? wsl-u24.local. ANY (QM)? a.9.e.a.c.4.5.2.3.3.5.a.7.7.5.2.0.0.0.0.0.0.0.0.0.0.0.0.0.8.e.f.ip6.arpa. (209)
09:53:08.234629 eth2  M   IP 192.168.1.190.mdns > mdns.mcast.net.mdns: 0 [3q] [4n] ANY (QM)? 190.1.168.192.in-addr.arpa. ANY (QM)? wsl-u24.local. ANY (QM)? a.9.e.a.c.4.5.2.3.3.5.a.7.7.5.2.0.0.0.0.0.0.0.0.0.0.0.0.0.8.e.f.ip6.arpa. (209)
09:53:08.235208 eth2  M   IP6 fe80::2577:a533:254c:ae9a.mdns > ff02::fb.mdns: 0 [2q] [2n] ANY (QM)? a.9.e.a.c.4.5.2.3.3.5.a.7.7.5.2.0.0.0.0.0.0.0.0.0.0.0.0.0.8.e.f.ip6.arpa. ANY (QM)? wsl-u24.local. (151)
09:53:08.235937 eth2  M   IP6 fe80::2577:a533:254c:ae9a.mdns > ff02::fb.mdns: 0 [2q] [2n] ANY (QM)? a.9.e.a.c.4.5.2.3.3.5.a.7.7.5.2.0.0.0.0.0.0.0.0.0.0.0.0.0.8.e.f.ip6.arpa. ANY (QM)? wsl-u24.local. (151)
09:53:08.443648 eth2  M   IP 192.168.1.190.mdns > mdns.mcast.net.mdns: 0 [3q] [4n] ANY (QM)? 190.1.168.192.in-addr.arpa. ANY (QM)? wsl-u24.local. ANY (QM)? a.9.e.a.c.4.5.2.3.3.5.a.7.7.5.2.0.0.0.0.0.0.0.0.0.0.0.0.0.8.e.f.ip6.arpa. (209)
09:53:08.444193 eth2  M   IP 192.168.1.190.mdns > mdns.mcast.net.mdns: 0 [3q] [4n] ANY (QM)? 190.1.168.192.in-addr.arpa. ANY (QM)? wsl-u24.local. ANY (QM)? a.9.e.a.c.4.5.2.3.3.5.a.7.7.5.2.0.0.0.0.0.0.0.0.0.0.0.0.0.8.e.f.ip6.arpa. (209)
09:53:08.444428 eth2  M   IP6 fe80::2577:a533:254c:ae9a.mdns > ff02::fb.mdns: 0 [2q] [2n] ANY (QM)? a.9.e.a.c.4.5.2.3.3.5.a.7.7.5.2.0.0.0.0.0.0.0.0.0.0.0.0.0.8.e.f.ip6.arpa. ANY (QM)? wsl-u24.local. (151)
09:53:08.444785 eth2  M   IP6 fe80::2577:a533:254c:ae9a.mdns > ff02::fb.mdns: 0 [2q] [2n] ANY (QM)? a.9.e.a.c.4.5.2.3.3.5.a.7.7.5.2.0.0.0.0.0.0.0.0.0.0.0.0.0.8.e.f.ip6.arpa. ANY (QM)? wsl-u24.local. (151)
09:53:08.758430 eth2  M   IP 192.168.1.190.mdns > mdns.mcast.net.mdns: 0 [3q] [4n] ANY (QM)? 190.1.168.192.in-addr.arpa. ANY (QM)? wsl-u24.local. ANY (QM)? a.9.e.a.c.4.5.2.3.3.5.a.7.7.5.2.0.0.0.0.0.0.0.0.0.0.0.0.0.8.e.f.ip6.arpa. (209)
09:53:08.759250 eth2  M   IP 192.168.1.190.mdns > mdns.mcast.net.mdns: 0 [3q] [4n] ANY (QM)? 190.1.168.192.in-addr.arpa. ANY (QM)? wsl-u24.local. ANY (QM)? a.9.e.a.c.4.5.2.3.3.5.a.7.7.5.2.0.0.0.0.0.0.0.0.0.0.0.0.0.8.e.f.ip6.arpa. (209)
09:53:08.759656 eth2  M   IP6 fe80::2577:a533:254c:ae9a.mdns > ff02::fb.mdns: 0 [2q] [2n] ANY (QM)? a.9.e.a.c.4.5.2.3.3.5.a.7.7.5.2.0.0.0.0.0.0.0.0.0.0.0.0.0.8.e.f.ip6.arpa. ANY (QM)? wsl-u24.local. (151)
09:53:08.760462 eth2  M   IP6 fe80::2577:a533:254c:ae9a.mdns > ff02::fb.mdns: 0 [2q] [2n] ANY (QM)? a.9.e.a.c.4.5.2.3.3.5.a.7.7.5.2.0.0.0.0.0.0.0.0.0.0.0.0.0.8.e.f.ip6.arpa. ANY (QM)? wsl-u24.local. (151)
09:53:08.968304 eth2  M   IP 192.168.1.190.mdns > mdns.mcast.net.mdns: 0*- [0q] 2/0/0 (Cache flush) PTR wsl-u24.local., (Cache flush) A 192.168.1.190 (81)
09:53:08.968305 eth2  M   IP 192.168.1.190.mdns > mdns.mcast.net.mdns: 0*- [0q] 2/0/0 (Cache flush) PTR wsl-u24.local., (Cache flush) AAAA fe80::2577:a533:254c:ae9a (139)
09:53:08.969412 eth2  M   IP 192.168.1.190.mdns > mdns.mcast.net.mdns: 0*- [0q] 2/0/0 (Cache flush) PTR wsl-u24.local., (Cache flush) A 192.168.1.190 (81)
09:53:08.969413 eth2  M   IP 192.168.1.190.mdns > mdns.mcast.net.mdns: 0*- [0q] 2/0/0 (Cache flush) PTR wsl-u24.local., (Cache flush) AAAA fe80::2577:a533:254c:ae9a (139)
09:53:08.970212 eth2  M   IP6 fe80::2577:a533:254c:ae9a.mdns > ff02::fb.mdns: 0*- [0q] 2/0/0 (Cache flush) PTR wsl-u24.local., (Cache flush) AAAA fe80::2577:a533:254c:ae9a (139)
09:53:08.971133 eth2  M   IP6 fe80::2577:a533:254c:ae9a.mdns > ff02::fb.mdns: 0*- [0q] 2/0/0 (Cache flush) PTR wsl-u24.local., (Cache flush) AAAA fe80::2577:a533:254c:ae9a (139)
09:53:10.139177 eth2  M   IP 192.168.1.190.mdns > mdns.mcast.net.mdns: 0*- [0q] 2/0/0 (Cache flush) PTR wsl-u24.local., (Cache flush) A 192.168.1.190 (81)
09:53:10.139178 eth2  M   IP 192.168.1.190.mdns > mdns.mcast.net.mdns: 0*- [0q] 2/0/0 (Cache flush) PTR wsl-u24.local., (Cache flush) AAAA fe80::2577:a533:254c:ae9a (139)
09:53:10.139733 eth2  M   IP 192.168.1.190.mdns > mdns.mcast.net.mdns: 0*- [0q] 2/0/0 (Cache flush) PTR wsl-u24.local., (Cache flush) A 192.168.1.190 (81)
09:53:10.139734 eth2  M   IP 192.168.1.190.mdns > mdns.mcast.net.mdns: 0*- [0q] 2/0/0 (Cache flush) PTR wsl-u24.local., (Cache flush) AAAA fe80::2577:a533:254c:ae9a (139)
09:53:10.140969 eth2  M   IP6 fe80::2577:a533:254c:ae9a.mdns > ff02::fb.mdns: 0*- [0q] 2/0/0 (Cache flush) PTR wsl-u24.local., (Cache flush) AAAA fe80::2577:a533:254c:ae9a (139)
09:53:10.140969 eth2  M   IP6 fe80::2577:a533:254c:ae9a.mdns > ff02::fb.mdns: 0*- [0q] 2/0/0 (Cache flush) PTR wsl-u24.local., (Cache flush) AAAA fe80::2577:a533:254c:ae9a (139)
09:53:12.496791 eth2  M   IP 192.168.1.190.mdns > mdns.mcast.net.mdns: 0*- [0q] 4/0/0 (Cache flush) PTR wsl-u24.local., (Cache flush) AAAA fe80::2577:a533:254c:ae9a, (Cache flush) PTR wsl-u24.local., (Cache flush) A 192.168.1.190 (191)
09:53:12.497308 eth2  M   IP 192.168.1.190.mdns > mdns.mcast.net.mdns: 0*- [0q] 4/0/0 (Cache flush) PTR wsl-u24.local., (Cache flush) AAAA fe80::2577:a533:254c:ae9a, (Cache flush) PTR wsl-u24.local., (Cache flush) A 192.168.1.190 (191)
09:53:12.497384 eth2  M   IP6 fe80::2577:a533:254c:ae9a.mdns > ff02::fb.mdns: 0*- [0q] 2/0/0 (Cache flush) PTR wsl-u24.local., (Cache flush) AAAA fe80::2577:a533:254c:ae9a (139)
09:53:12.497735 eth2  M   IP6 fe80::2577:a533:254c:ae9a.mdns > ff02::fb.mdns: 0*- [0q] 2/0/0 (Cache flush) PTR wsl-u24.local., (Cache flush) AAAA fe80::2577:a533:254c:ae9a (139)
09:53:12.604114 eth2  M   IP 192.168.1.148.mdns > mdns.mcast.net.mdns: 0 [3q] PTR (QU)? _companion-link._tcp.local. PTR (QU)? _rdlink._tcp.local. PTR (QU)? _homekit._tcp.local. (73)
09:53:12.604414 eth2  M   IP 192.168.1.148.mdns > mdns.mcast.net.mdns: 0 [3q] PTR (QU)? _companion-link._tcp.local. PTR (QU)? _rdlink._tcp.local. PTR (QU)? _homekit._tcp.local. (73)
09:53:12.605322 eth2  M   IP6 fe80::c5c:9b97:6967:ef0a.mdns > ff02::fb.mdns: 0 [3q] PTR (QU)? _companion-link._tcp.local. PTR (QU)? _rdlink._tcp.local. PTR (QU)? _homekit._tcp.local. (73)
09:53:12.605323 eth2  M   IP6 fe80::c5c:9b97:6967:ef0a.mdns > ff02::fb.mdns: 0 [3q] PTR (QU)? _companion-link._tcp.local. PTR (QU)? _rdlink._tcp.local. PTR (QU)? _homekit._tcp.local. (73)
09:53:13.670782 eth2  M   IP 192.168.1.148.mdns > mdns.mcast.net.mdns: 0 [3q] PTR (QM)? _companion-link._tcp.local. PTR (QM)? _rdlink._tcp.local. PTR (QM)? _homekit._tcp.local. (73)
09:53:13.671335 eth2  M   IP 192.168.1.148.mdns > mdns.mcast.net.mdns: 0 [3q] PTR (QM)? _companion-link._tcp.local. PTR (QM)? _rdlink._tcp.local. PTR (QM)? _homekit._tcp.local. (73)
09:53:13.671955 eth2  M   IP6 fe80::c5c:9b97:6967:ef0a.mdns > ff02::fb.mdns: 0 [3q] PTR (QM)? _companion-link._tcp.local. PTR (QM)? _rdlink._tcp.local. PTR (QM)? _homekit._tcp.local. (73)
09:53:13.672617 eth2  M   IP6 fe80::c5c:9b97:6967:ef0a.mdns > ff02::fb.mdns: 0 [3q] PTR (QM)? _companion-link._tcp.local. PTR (QM)? _rdlink._tcp.local. PTR (QM)? _homekit._tcp.local. (73)
09:53:16.451290 eth5  Out IP 192.168.100.207.mdns > mdns.mcast.net.mdns: 0 PTR (QU)? _http._tcp.local. (34)
09:53:16.451314 lo    In  IP 10.255.255.254.mdns > mdns.mcast.net.mdns: 0 PTR (QU)? _http._tcp.local. (34)
09:53:16.451329 eth2  Out IP host.docker.internal.mdns > mdns.mcast.net.mdns: 0 PTR (QU)? _http._tcp.local. (34)
09:53:16.451344 eth1  Out IP 169.254.83.107.mdns > mdns.mcast.net.mdns: 0 PTR (QU)? _http._tcp.local. (34)
09:53:16.451688 lo    In  IP 192.168.100.207.mdns > 192.168.100.207.mdns: 0*- [0q] 1/0/4 PTR MyPythonService._http._tcp.local. (177)
09:53:16.451823 lo    In  IP 10.255.255.254.mdns > 10.255.255.254.mdns: 0*- [0q] 1/0/4 PTR MyPythonService._http._tcp.local. (177)
09:53:16.452124 lo    In  IP host.docker.internal.mdns > host.docker.internal.mdns: 0*- [0q] 1/0/4 PTR MyPythonService._http._tcp.local. (177)
09:53:16.452279 lo    In  IP 169.254.83.107.mdns > 169.254.83.107.mdns: 0*- [0q] 1/0/4 PTR MyPythonService._http._tcp.local. (177)
09:53:16.763463 eth2  M   IP 192.168.1.148.mdns > mdns.mcast.net.mdns: 0 [3q] PTR (QM)? _companion-link._tcp.local. PTR (QM)? _rdlink._tcp.local. PTR (QM)? _homekit._tcp.local. (73)
09:53:16.763820 eth2  M   IP 192.168.1.148.mdns > mdns.mcast.net.mdns: 0 [3q] PTR (QM)? _companion-link._tcp.local. PTR (QM)? _rdlink._tcp.local. PTR (QM)? _homekit._tcp.local. (73)
09:53:16.763964 eth2  M   IP6 fe80::c5c:9b97:6967:ef0a.mdns > ff02::fb.mdns: 0 [3q] PTR (QM)? _companion-link._tcp.local. PTR (QM)? _rdlink._tcp.local. PTR (QM)? _homekit._tcp.local. (73)
09:53:16.764346 eth2  M   IP6 fe80::c5c:9b97:6967:ef0a.mdns > ff02::fb.mdns: 0 [3q] PTR (QM)? _companion-link._tcp.local. PTR (QM)? _rdlink._tcp.local. PTR (QM)? _homekit._tcp.local. (73)
09:53:17.453437 eth5  Out IP 192.168.100.207.mdns > mdns.mcast.net.mdns: 0 [1a] PTR (QM)? _http._tcp.local. (64)
09:53:17.453456 lo    In  IP 10.255.255.254.mdns > mdns.mcast.net.mdns: 0 [1a] PTR (QM)? _http._tcp.local. (64)
09:53:17.453468 eth2  Out IP host.docker.internal.mdns > mdns.mcast.net.mdns: 0 [1a] PTR (QM)? _http._tcp.local. (64)
09:53:17.453480 eth1  Out IP 169.254.83.107.mdns > mdns.mcast.net.mdns: 0 [1a] PTR (QM)? _http._tcp.local. (64)
09:53:17.700840 eth2  M   IP 192.168.1.73.mdns > mdns.mcast.net.mdns: 0*- [0q] 1/0/6 PTR EPSON ET-16650 Series._http._tcp.local. (194)
09:53:17.701234 eth2  M   IP 192.168.1.73.mdns > mdns.mcast.net.mdns: 0*- [0q] 1/0/6 PTR EPSON ET-16650 Series._http._tcp.local. (194)
09:53:17.701489 eth2  M   IP6 fe80::decd:2fff:fe7f:6a70.mdns > ff02::fb.mdns: 0*- [0q] 1/0/6 PTR EPSON ET-16650 Series._http._tcp.local. (194)
09:53:17.701859 eth2  M   IP6 fe80::decd:2fff:fe7f:6a70.mdns > ff02::fb.mdns: 0*- [0q] 1/0/6 PTR EPSON ET-16650 Series._http._tcp.local. (194)
09:53:20.753385 eth2  M   IP6 fe80::c0e4:f2a7:e65c:ab5d.mdns > ff02::fb.mdns: 0 [1a] PTR (QM)? _smb._tcp.local. (69)
09:53:20.754116 eth2  M   IP6 fe80::c0e4:f2a7:e65c:ab5d.mdns > ff02::fb.mdns: 0 [1a] PTR (QM)? _smb._tcp.local. (69)
09:53:20.966900 eth2  M   IP6 fe80::b4c6:999d:a6d0:30ae.mdns > ff02::fb.mdns: 0 ANY (QM)? delly.local. (29)
09:53:20.966901 eth2  M   IP6 fe80::b4c6:999d:a6d0:30ae.mdns > ff02::fb.mdns: 0*- [0q] 2/0/0 AAAA fe80::b4c6:999d:a6d0:30ae, A 192.168.1.98 (67)
09:53:20.966901 eth2  M   IP6 fe80::b4c6:999d:a6d0:30ae.mdns > ff02::fb.mdns: 0 ANY (QM)? delly.local. (29)
09:53:20.966901 eth2  M   IP6 fe80::b4c6:999d:a6d0:30ae.mdns > ff02::fb.mdns: 0*- [0q] 2/0/0 AAAA fe80::b4c6:999d:a6d0:30ae, A 192.168.1.98 (67)
09:53:20.967576 eth2  M   IP 192.168.1.98.mdns > mdns.mcast.net.mdns: 0 ANY (QM)? delly.local. (29)
09:53:20.967577 eth2  M   IP 192.168.1.98.mdns > mdns.mcast.net.mdns: 0*- [0q] 2/0/0 AAAA fe80::b4c6:999d:a6d0:30ae, A 192.168.1.98 (67)
09:53:20.968057 eth2  M   IP 192.168.1.98.mdns > mdns.mcast.net.mdns: 0 ANY (QM)? delly.local. (29)
09:53:20.968058 eth2  M   IP 192.168.1.98.mdns > mdns.mcast.net.mdns: 0*- [0q] 2/0/0 AAAA fe80::b4c6:999d:a6d0:30ae, A 192.168.1.98 (67)
09:53:21.455256 eth5  Out IP 192.168.100.207.mdns > mdns.mcast.net.mdns: 0 [2a] PTR (QM)? _http._tcp.local. (100)
09:53:21.455275 lo    In  IP 10.255.255.254.mdns > mdns.mcast.net.mdns: 0 [2a] PTR (QM)? _http._tcp.local. (100)
09:53:21.455286 eth2  Out IP host.docker.internal.mdns > mdns.mcast.net.mdns: 0 [2a] PTR (QM)? _http._tcp.local. (100)
09:53:21.455297 eth1  Out IP 169.254.83.107.mdns > mdns.mcast.net.mdns: 0 [2a] PTR (QM)? _http._tcp.local. (100)
^C
126 packets captured
186 packets received by filter